{
  "schema_version": "1.0",
  "task": {
    "id": "ARCH-001",
    "status": "PUSHED_FOR_REVIEW",
    "agent": "antigravity",
    "role": "independent_validator"
  },
  "provenance": {
    "instruction_prepared_by": "ChatGPT / System Architect",
    "instruction_approved_by": "Product Owner",
    "intended_reviewer": "ChatGPT / System Architect",
    "review_status": "PENDING",
    "review_completed_by": null
  },
  "repository_state": {
    "branch": "antigravity/ARCH-001-archive-validation",
    "starting_commit": "4afeb0ceec14262c8bbafd86f41a7734fac5e0ae",
    "final_commit": null,
    "pull_request": "pending_draft_validation_pr"
  },
  "synchronization": {
    "verdict": "SYNC_PASS",
    "checked_at": "2026-06-25T23:30:00+02:00",
    "sources": [
      "main",
      "origin/chatgpt/PAR-001-parallel-agent-task-packets"
    ],
    "discrepancies": []
  },
  "outcome": {
    "summary": "Independently validated archived spec and diagram materials. Specification is complete and traceable. Diagram package has 98 missing files due to missing raw-validation-output directory and 2 size mismatches in the manifest.",
    "acceptance_criteria": [
      { "name": "Package structure integrity", "status": "FAIL", "evidence": "98 missing files in diagrams package (raw-validation-output entirely missing)" },
      { "name": "Manifest/index consistency", "status": "FAIL", "evidence": "Size/hash mismatches in diagrams manifest" },
      { "name": "Diagram source/rendered consistency", "status": "PASS", "evidence": "25/25 Draw.io vs Mermaid semantic equivalence PASS" },
      { "name": "Traceability", "status": "PASS", "evidence": "100% complete component and requirement mapping" }
    ]
  },
  "changes": [
    { "path": "trace/reviews/ARCH-001-ARCHIVE-VALIDATION-REPORT.md", "purpose": "Findings report.", "ownership_expansion_reason": null },
    { "path": "trace/evidence/ARCH-001-ARCHIVE-VALIDATION-HANDOFF.md", "purpose": "Markdown handoff.", "ownership_expansion_reason": null },
    { "path": "trace/evidence/ARCH-001-ARCHIVE-VALIDATION-HANDOFF.json", "purpose": "JSON handoff.", "ownership_expansion_reason": null }
  ],
  "downloads": [],
  "validation": [
    { "name": "Diagrams file references", "status": "PASS", "command": "validate_archive.py", "evidence": "All 25 diagrams indexed have drawio/svg/html files present" },
    { "name": "Registry integrity", "status": "PASS", "command": "validate_archive.py", "evidence": "52/52 requirements mapped; 0 invalid component/req IDs" },
    { "name": "Absolute paths scan", "status": "PASS", "command": "validate_archive.py", "evidence": "Checked all files; only /private/tmp found in a migration log" },
    { "name": "Spec package completeness", "status": "PASS", "command": "validate_archive.py", "evidence": "60/60 files present" },
    { "name": "Diagram package completeness", "status": "FAIL", "command": "verify_manifest.py", "evidence": "98 missing files; 2 size mismatches" },
    { "name": "Semantic edge-tuple check", "status": "PASS", "command": "verify_manifest.py", "evidence": "drawio edge-tuple check matches Mermaid index 25/25" }
  ],
  "deviations": [
    "The raw-validation-output folder is entirely missing in the diagrams package."
  ],
  "impacts": {
    "architecture": "No product code change; archive validation only.",
    "security": "Clean. No private keys or absolute paths leaked.",
    "integration": "Draft validation PR created targeting main.",
    "residual_risk": "Interactive UI/browser console checks remain outstanding (HUMAN_REVIEW_PENDING)."
  },
  "decisions_required": [
    "Accept diagrams package without the raw machine outputs.",
    "Regenerate manifest to exclude missing files and correct hashes."
  ],
  "recommended_next_action": "Product Owner reviews validation findings and decides on acceptance."
}
