{
  "schema_version": "1.0",
  "task": {
    "id": "GOV-005",
    "status": "PUSHED_FOR_REVIEW",
    "agent": "antigravity",
    "role": "independent_validator"
  },
  "provenance": {
    "instruction_prepared_by": "ChatGPT / System Architect",
    "instruction_approved_by": "Product Owner",
    "intended_reviewer": "ChatGPT / System Architect",
    "review_status": "PENDING",
    "review_completed_by": null
  },
  "repository_state": {
    "branch": "antigravity/GOV-005-corrections-validation",
    "starting_commit": "bc5194e025f4f16da2c1ab867aed8e632258f147",
    "final_commit": null,
    "pull_request": "pending_draft_validation_pr"
  },
  "synchronization": {
    "verdict": "SYNC_PASS",
    "checked_at": "2026-06-24T23:40:00+02:00",
    "sources": [
      "origin/main",
      "PR #17 (draft)",
      "target head 61098c0",
      "trace/ACTIVE_WORK_REGISTRY.yaml"
    ],
    "discrepancies": []
  },
  "outcome": {
    "summary": "Independently validated PR #17. CF-1..CF-4 and CF-6 are fully corrected. CF-5 has a design-level bypass where cross-task changes are permitted.",
    "acceptance_criteria": [
      { "name": "CI enforcement (CF-1)", "status": "PASS", "evidence": "PR #17 CI logs and workflow configuration" },
      { "name": "Synchronization authority (CF-2)", "status": "PASS", "evidence": "trace/ACTIVE_WORK_REGISTRY.yaml and docs/governance/MULTI_AGENT_EXECUTION_POLICY.md" },
      { "name": "Status authority (CF-3)", "status": "PASS", "evidence": "trace/ACTIVE_WORK_REGISTRY.yaml and validator scripts" },
      { "name": "Status vocabulary validation (CF-4)", "status": "PASS", "evidence": "programmatic negative tests N1, N1b" },
      { "name": "Handoff path ownership (CF-5)", "status": "FAIL", "evidence": "programmatic negative tests N6, N7 showing ownership bypass" },
      { "name": "Provenance contract (CF-6)", "status": "PASS", "evidence": "programmatic negative tests N2, N2b, N3, N3b" }
    ]
  },
  "changes": [
    { "path": "trace/ACTIVE_WORK_REGISTRY.yaml", "purpose": "Register independent validation task.", "ownership_expansion_reason": null },
    { "path": "trace/reviews/GOV-005-ANTIGRAVITY-VALIDATION-REPORT.md", "purpose": "Independent validation findings report.", "ownership_expansion_reason": null },
    { "path": "trace/evidence/GOV-005-ANTIGRAVITY-VALIDATION-HANDOFF.md", "purpose": "Markdown handoff report.", "ownership_expansion_reason": null },
    { "path": "trace/evidence/GOV-005-ANTIGRAVITY-VALIDATION-HANDOFF.json", "purpose": "JSON handoff report.", "ownership_expansion_reason": null }
  ],
  "downloads": [],
  "validation": [
    { "name": "Positive Validator Check", "status": "PASS", "command": "python3 scripts/validate_multi_agent_governance.py", "evidence": "active tasks validated: 5" },
    { "name": "Negative N1 Handoff Status", "status": "PASS", "command": "run_negative_tests.py", "evidence": "AssertionError on out-of-vocabulary status" },
    { "name": "Negative N2 Legacy Provenance", "status": "PASS", "command": "run_negative_tests.py", "evidence": "AssertionError on reviewed_by" },
    { "name": "Negative N3 Review Completed Empty", "status": "PASS", "command": "run_negative_tests.py", "evidence": "AssertionError on missing completed reviewer" },
    { "name": "Negative N4 Forbidden Changed Path", "status": "PASS", "command": "run_negative_tests.py", "evidence": "AssertionError on src/runtime/app.py" },
    { "name": "Negative N5 Allowed Changed Path", "status": "PASS", "command": "run_negative_tests.py", "evidence": "PASS on allowed paths" },
    { "name": "Negative N6 Cross-Task Bypass", "status": "FAIL", "command": "run_negative_tests.py", "evidence": "Bypass on trace/tasks/ARCH-001.md (allowed)" },
    { "name": "Negative N7 Union-of-ownership Bypass", "status": "FAIL", "command": "run_negative_tests.py", "evidence": "Bypass on docs/architecture/spec.md (allowed)" }
  ],
  "deviations": [
    "Programmatic validation revealed a bypass in CF-5 where changed path ownership allows cross-task modifications."
  ],
  "impacts": {
    "architecture": "No product code change; repository governance only.",
    "security": "Enforcement added in CI; however, parallel task isolation has bypass potential.",
    "integration": "Draft validation PR created targeting claude/GOV-005-corrections.",
    "residual_risk": "Cross-task path alterations remain allowed under the current check."
  },
  "decisions_required": [
    "Harden check_changed_path_ownership.py to enforce branch-to-task restriction mappings.",
    "Acceptance of the correction set despite the CF-5 union bypass."
  ],
  "recommended_next_action": "Product Owner reviews validation findings and decides on merge."
}
